{
  "artifacts": {
    "observations": {
      "byte_size": 22040,
      "path": "docs/evidence/WP-0002/local-operator-amendment/scope-capture/working-tree-scope.observations.62fe75736f5838d153b20882094fafff91498a59ce437475dc562613860b58a9.json",
      "sha256": "62fe75736f5838d153b20882094fafff91498a59ce437475dc562613860b58a9"
    },
    "raw_status": {
      "byte_size": 2488,
      "path": "docs/evidence/WP-0002/local-operator-amendment/scope-capture/working-tree-scope.status.bea960c9a69eda2a80c43103d093da728e30df0c65763f17ba6d1a994ea83d02.bin",
      "sha256": "bea960c9a69eda2a80c43103d093da728e30df0c65763f17ba6d1a994ea83d02"
    }
  },
  "base_commit": "375416c0dd7f60c2a36f9a7d8f7df819d74b60eb",
  "boundary_manifest_id": "A1B-WP-0002-LOCAL-DEV",
  "canonical_main_binding": {
    "branch_ref": "refs/heads/main",
    "origin_main_commit": "375416c0dd7f60c2a36f9a7d8f7df819d74b60eb",
    "origin_url": "https://github.com/AC-21/sasha-the-land-pirate.git",
    "top_level": "/Users/sasha/Projects/sasha-the-land-pirate"
  },
  "capture_contract": "wp0002-local-operator-amendment-scope-capture-v1",
  "captured_at": "2026-07-18T03:54:13.067291Z",
  "checkpoint_commit": "375416c0dd7f60c2a36f9a7d8f7df819d74b60eb",
  "collector": {
    "git_version": "git version 2.39.5 (Apple Git-154)",
    "head_command": [
      "git",
      "rev-parse",
      "--verify",
      "HEAD"
    ],
    "head_tree_command": [
      "git",
      "rev-parse",
      "HEAD^{tree}"
    ],
    "index_tree_command": [
      "git",
      "diff",
      "--cached",
      "--quiet",
      "HEAD",
      "--"
    ],
    "status_command": [
      "/usr/bin/git",
      "-c",
      "core.hooksPath=/dev/null",
      "-C",
      "/Users/sasha/Projects/sasha-the-land-pirate",
      "status",
      "--porcelain=v2",
      "-z",
      "--untracked-files=all"
    ],
    "submodule_command": [
      "git",
      "ls-files",
      "-s",
      "-z"
    ]
  },
  "complete_dirty_set": true,
  "conflict_paths": [],
  "dirty_path_count": 24,
  "dirty_paths": [
    {
      "base_blob_sha256": null,
      "normalized_git_state": "untracked",
      "observed_sha256": "ab4ae0fc1a01078125ac559fec6192f409edd7e4eef628aff0cde8b516ba18c6",
      "owner": "packet-generated-evidence",
      "path": "BuildArtifacts/WP-0002/unity-gates/asset-refresh-and-compile-295aad2367504ff1bb8f8d1b5b5d7fac.json",
      "policy": "preserve-observe-no-agent-modify-stage-commit-delete-revert-stash",
      "regular_file_no_symlink": true
    },
    {
      "base_blob_sha256": null,
      "normalized_git_state": "untracked",
      "observed_sha256": "d00bcb2f7d3956a8764d6be809dc4eec28156eff9bc4ce2aeab86d26a07a273c",
      "owner": "packet-generated-evidence",
      "path": "BuildArtifacts/WP-0002/unity-gates/asset-refresh-and-compile-52ceb864b65442ce98f047d2d4dee443.json",
      "policy": "preserve-observe-no-agent-modify-stage-commit-delete-revert-stash",
      "regular_file_no_symlink": true
    },
    {
      "base_blob_sha256": null,
      "normalized_git_state": "untracked",
      "observed_sha256": "8ecda362e9ea738e4f656f3991a54cec2f211e9038fdc3a189ef31cf05b28478",
      "owner": "packet-generated-evidence",
      "path": "BuildArtifacts/WP-0002/unity-gates/asset-refresh-and-compile-5c92bd6afcb4453d8d3f3ee1e57fafb8.json",
      "policy": "preserve-observe-no-agent-modify-stage-commit-delete-revert-stash",
      "regular_file_no_symlink": true
    },
    {
      "base_blob_sha256": null,
      "normalized_git_state": "untracked",
      "observed_sha256": "c135f099810a98791cfa9f019034bd67b2807f301c8473c143ace481d7fccb9c",
      "owner": "packet-generated-evidence",
      "path": "BuildArtifacts/WP-0002/unity-gates/asset-refresh-and-compile-73f9b609c8e34c70b32264d4043ee80e.json",
      "policy": "preserve-observe-no-agent-modify-stage-commit-delete-revert-stash",
      "regular_file_no_symlink": true
    },
    {
      "base_blob_sha256": null,
      "normalized_git_state": "untracked",
      "observed_sha256": "b331a3a8590ed1c267543793592cb47ab229fa2fc7c5b0f996b8855d89dde843",
      "owner": "packet-generated-evidence",
      "path": "BuildArtifacts/WP-0002/unity-gates/asset-refresh-and-compile-ab0212f9a1b1406aab274a2d67e0d901.json",
      "policy": "preserve-observe-no-agent-modify-stage-commit-delete-revert-stash",
      "regular_file_no_symlink": true
    },
    {
      "base_blob_sha256": null,
      "normalized_git_state": "untracked",
      "observed_sha256": "a8e08eb02ac307abe12a22b210426abe270e0216ba095d3f029733df10917ba6",
      "owner": "packet-generated-evidence",
      "path": "BuildArtifacts/WP-0002/unity-gates/asset-refresh-and-compile-bcbe1fce9f804913a85f701ebd33ef59.json",
      "policy": "preserve-observe-no-agent-modify-stage-commit-delete-revert-stash",
      "regular_file_no_symlink": true
    },
    {
      "base_blob_sha256": null,
      "normalized_git_state": "untracked",
      "observed_sha256": "6f6e8026f529660b6bef2e63e53ad6eec61757f74d8ebbb183d7c6a4d6a9ace9",
      "owner": "packet-generated-evidence",
      "path": "BuildArtifacts/WP-0002/unity-gates/asset-refresh-and-compile-d7119df9a5314f35a542dd578eb07322.json",
      "policy": "preserve-observe-no-agent-modify-stage-commit-delete-revert-stash",
      "regular_file_no_symlink": true
    },
    {
      "base_blob_sha256": null,
      "normalized_git_state": "untracked",
      "observed_sha256": "9a85bc5cdc1f5b196de94ce2a2e893b5c547054a48d410c5c865fa148c9a391f",
      "owner": "packet-generated-evidence",
      "path": "BuildArtifacts/WP-0002/unity-gates/wp0002-editmode-test-assembly-20c04c13378544cca07ac8856242676c.json",
      "policy": "preserve-observe-no-agent-modify-stage-commit-delete-revert-stash",
      "regular_file_no_symlink": true
    },
    {
      "base_blob_sha256": null,
      "normalized_git_state": "untracked",
      "observed_sha256": "cbf2434deccdcefefca0e8931d0c3babb896aceb1fbb89a5e6e4ab2665aae798",
      "owner": "packet-generated-evidence",
      "path": "BuildArtifacts/WP-0002/unity-gates/wp0002-editmode-test-assembly-3a50e5651e2b43d1b957d8ad4ef0a04f.json",
      "policy": "preserve-observe-no-agent-modify-stage-commit-delete-revert-stash",
      "regular_file_no_symlink": true
    },
    {
      "base_blob_sha256": null,
      "normalized_git_state": "untracked",
      "observed_sha256": "19f64e33f1a4abf9d00578febaed8cdea0b56425871e5646b524c0fb653f2f77",
      "owner": "packet-generated-evidence",
      "path": "BuildArtifacts/WP-0002/unity-gates/wp0002-editmode-test-assembly-4fe277cb161b4282a91cc24d0222e07e.json",
      "policy": "preserve-observe-no-agent-modify-stage-commit-delete-revert-stash",
      "regular_file_no_symlink": true
    },
    {
      "base_blob_sha256": null,
      "normalized_git_state": "untracked",
      "observed_sha256": "b4e5e988932f0d5e0efe163e8e6887c04b5bbc60645618a7224a912803c925b5",
      "owner": "packet-generated-evidence",
      "path": "BuildArtifacts/WP-0002/unity-gates/wp0002-editmode-test-assembly-5691a516124d4d63aea947b5d2893916.json",
      "policy": "preserve-observe-no-agent-modify-stage-commit-delete-revert-stash",
      "regular_file_no_symlink": true
    },
    {
      "base_blob_sha256": null,
      "normalized_git_state": "untracked",
      "observed_sha256": "5679899d1995784ec0385ce7d6d097a36fc532fe62232f50d9adf698ba2380bb",
      "owner": "packet-generated-evidence",
      "path": "BuildArtifacts/WP-0002/unity-gates/wp0002-editmode-test-assembly-6aff32be623b4812a65ad784ea26ec81.json",
      "policy": "preserve-observe-no-agent-modify-stage-commit-delete-revert-stash",
      "regular_file_no_symlink": true
    },
    {
      "base_blob_sha256": null,
      "normalized_git_state": "untracked",
      "observed_sha256": "724892930cf4a207e65adf62b04aa3465398a83d8aee98dc7652e3bbb366f366",
      "owner": "packet-generated-evidence",
      "path": "BuildArtifacts/WP-0002/unity-gates/wp0002-editmode-test-assembly-a6a066aa483c4bdba7afff6f8e520a17.json",
      "policy": "preserve-observe-no-agent-modify-stage-commit-delete-revert-stash",
      "regular_file_no_symlink": true
    },
    {
      "base_blob_sha256": null,
      "normalized_git_state": "untracked",
      "observed_sha256": "daa7033cff5017f10191a277be249e65c19951a23bd68212a2a9d59fab7ab45b",
      "owner": "packet-generated-evidence",
      "path": "BuildArtifacts/WP-0002/unity-gates/wp0002-editmode-test-assembly-edf8b8b9f9114c3e89d41e3f024edec7.json",
      "policy": "preserve-observe-no-agent-modify-stage-commit-delete-revert-stash",
      "regular_file_no_symlink": true
    },
    {
      "base_blob_sha256": null,
      "normalized_git_state": "untracked",
      "observed_sha256": "e595ef23e65576264ca13596c7949cc541719ba1f9a55e24eac2a875404e9793",
      "owner": "packet-generated-evidence",
      "path": "BuildArtifacts/WP-0002/unity-gates/wp0002-playmode-test-assembly-099d151b5b254d1ba9d4e2cedef6105c.json",
      "policy": "preserve-observe-no-agent-modify-stage-commit-delete-revert-stash",
      "regular_file_no_symlink": true
    },
    {
      "base_blob_sha256": null,
      "normalized_git_state": "untracked",
      "observed_sha256": "60194e909766f7cd028ae0da353c98112e611c27a1c4e9d6de5321a7b94368b6",
      "owner": "packet-generated-evidence",
      "path": "BuildArtifacts/WP-0002/unity-gates/wp0002-playmode-test-assembly-5ad17e853567432da6263bd490c2444c.json",
      "policy": "preserve-observe-no-agent-modify-stage-commit-delete-revert-stash",
      "regular_file_no_symlink": true
    },
    {
      "base_blob_sha256": null,
      "normalized_git_state": "untracked",
      "observed_sha256": "14a0d85ad0a1aee5d2cac1bb9945c3b22fe24780064993a0aa6f32ca13b83067",
      "owner": "packet-generated-evidence",
      "path": "BuildArtifacts/WP-0002/unity-gates/wp0002-playmode-test-assembly-a2ca86d825bf41e99796d538794680da.json",
      "policy": "preserve-observe-no-agent-modify-stage-commit-delete-revert-stash",
      "regular_file_no_symlink": true
    },
    {